[
  {
    "route_id": "SAK_0001",
    "agency_id": "sbb",
    "name": "ADARAY",
    "code": "A1",
    "color": "#ff8400",
    "vehicle_type": "metro",
    "fare_id": "SAK_0001_FARE_TAM",
    "route_pattern": "round_trip",
    "stop_mode": "fixed",
    "source": "api-sbb",
    "updated_at": "2026-07-31T09:24:24Z"
  },
  {
    "route_id": "SAK_0002",
    "agency_id": "sbb",
    "name": "GAR MEYDANI - KORUCUK",
    "code": "M1",
    "color": "#f04646",
    "vehicle_type": "metro",
    "fare_id": "SAK_0002_FARE_TAM",
    "route_pattern": "round_trip",
    "stop_mode": "fixed",
    "source": "api-sbb",
    "updated_at": "2026-07-31T09:24:24Z"
  },
  {
    "route_id": "SAK_0003",
    "agency_id": "sbb",
    "name": "SAKARYAPARK - KÜPÇÜLER - K. TERMİNAL",
    "code": "1",
    "color": "#68bd9c",
    "vehicle_type": "bus",
    "fare_id": "SAK_0003_FARE_TAM",
    "route_pattern": "round_trip",
    "stop_mode": "fixed",
    "source": "api-sbb",
    "updated_at": "2026-07-31T09:24:24Z"
  },
  {
    "route_id": "SAK_0004",
    "agency_id": "sbb",
    "name": "ORTA GARAJ - HIZIR İLYAS",
    "code": "2",
    "color": "#68bd9c",
    "vehicle_type": "bus",
    "fare_id": "SAK_0004_FARE_TAM",
    "route_pattern": "loop",
    "stop_mode": "fixed",
    "source": "api-sbb",
    "updated_at": "2026-07-31T09:24:24Z"
  },
  {
    "route_id": "SAK_0005",
    "agency_id": "sbb",
    "name": "D. MEYDANI - YEŞİLTEPE - Y. TERMİNAL",
    "code": "3",
    "color": "#68bd9c",
    "vehicle_type": "bus",
    "fare_id": "SAK_0005_FARE_TAM",
    "route_pattern": "round_trip",
    "stop_mode": "fixed",
    "source": "api-sbb",
    "updated_at": "2026-07-31T09:24:24Z"
  },
  {
    "route_id": "SAK_0006",
    "agency_id": "sbb",
    "name": "KAMPÜS - SAKARYAPARK",
    "code": "4",
    "color": "#68bd9c",
    "vehicle_type": "bus",
    "fare_id": "SAK_0006_FARE_TAM",
    "route_pattern": "round_trip",
    "stop_mode": "fixed",
    "source": "api-sbb",
    "updated_at": "2026-07-31T09:24:24Z"
  },
  {
    "route_id": "SAK_0007",
    "agency_id": "sbb",
    "name": "O.GARAJ - OTUZİKİEVLER - BEŞKÖPRÜ - KAMPÜS",
    "code": "6",
    "color": "#68bd9c",
    "vehicle_type": "bus",
    "fare_id": "SAK_0007_FARE_TAM",
    "route_pattern": "round_trip",
    "stop_mode": "fixed",
    "source": "api-sbb",
    "updated_at": "2026-07-31T09:24:24Z"
  },
  {
    "route_id": "SAK_0008",
    "agency_id": "sbb",
    "name": "D. MEYDANI - YILDIZTEPE - Y. TERMİNAL",
    "code": "7",
    "color": "#68bd9c",
    "vehicle_type": "bus",
    "fare_id": "SAK_0008_FARE_TAM",
    "route_pattern": "round_trip",
    "stop_mode": "fixed",
    "source": "api-sbb",
    "updated_at": "2026-07-31T09:24:24Z"
  },
  {
    "route_id": "SAK_0009",
    "agency_id": "sbb",
    "name": "ORTA GARAJ - OZANLAR - YAZLIK",
    "code": "8A",
    "color": "#68bd9c",
    "vehicle_type": "bus",
    "fare_id": "SAK_0009_FARE_TAM",
    "route_pattern": "loop",
    "stop_mode": "fixed",
    "source": "api-sbb",
    "updated_at": "2026-07-31T09:24:24Z"
  },
  {
    "route_id": "SAK_0010",
    "agency_id": "sbb",
    "name": "ORTA GARAJ - ŞEKER - YAZLIK",
    "code": "8B",
    "color": "#68bd9c",
    "vehicle_type": "bus",
    "fare_id": "SAK_0010_FARE_TAM",
    "route_pattern": "loop",
    "stop_mode": "fixed",
    "source": "api-sbb",
    "updated_at": "2026-07-31T09:24:24Z"
  },
  {
    "route_id": "SAK_0011",
    "agency_id": "sbb",
    "name": "ORTA GARAJ - ALTYOL - MALTEPE",
    "code": "9A",
    "color": "#68bd9c",
    "vehicle_type": "bus",
    "fare_id": "SAK_0011_FARE_TAM",
    "route_pattern": "loop",
    "stop_mode": "fixed",
    "source": "api-sbb",
    "updated_at": "2026-07-31T09:24:24Z"
  },
  {
    "route_id": "SAK_0012",
    "agency_id": "sbb",
    "name": "ORTA GARAJ - MALTEPE",
    "code": "9B",
    "color": "#68bd9c",
    "vehicle_type": "bus",
    "fare_id": "SAK_0012_FARE_TAM",
    "route_pattern": "loop",
    "stop_mode": "fixed",
    "source": "api-sbb",
    "updated_at": "2026-07-31T09:24:24Z"
  },
  {
    "route_id": "SAK_0013",
    "agency_id": "sbb",
    "name": "SERDİVAN - HIZIRTEPE - SAKARYAPARK",
    "code": "11",
    "color": "#68bd9c",
    "vehicle_type": "bus",
    "fare_id": "SAK_0013_FARE_TAM",
    "route_pattern": "round_trip",
    "stop_mode": "fixed",
    "source": "api-sbb",
    "updated_at": "2026-07-31T09:24:24Z"
  },
  {
    "route_id": "SAK_0014",
    "agency_id": "sbb",
    "name": "YAZLIK - KAMPÜS - ESENTEPE",
    "code": "12",
    "color": "#68bd9c",
    "vehicle_type": "bus",
    "fare_id": "SAK_0014_FARE_TAM",
    "route_pattern": "round_trip",
    "stop_mode": "fixed",
    "source": "api-sbb",
    "updated_at": "2026-07-31T09:24:24Z"
  },
  {
    "route_id": "SAK_0015",
    "agency_id": "sbb",
    "name": "ESENTEPE - SEAH - O. GARAJ",
    "code": "12AR",
    "color": "#68bd9c",
    "vehicle_type": "bus",
    "fare_id": "SAK_0015_FARE_TAM",
    "route_pattern": "round_trip",
    "stop_mode": "fixed",
    "source": "api-sbb",
    "updated_at": "2026-07-31T09:24:24Z"
  },
  {
    "route_id": "SAK_0016",
    "agency_id": "sbb",
    "name": "ORTA GARAJ - LOJMANLAR - YAZLIK",
    "code": "14",
    "color": "#68bd9c",
    "vehicle_type": "bus",
    "fare_id": "SAK_0016_FARE_TAM",
    "route_pattern": "loop",
    "stop_mode": "fixed",
    "source": "api-sbb",
    "updated_at": "2026-07-31T09:24:24Z"
  },
  {
    "route_id": "SAK_0017",
    "agency_id": "sbb",
    "name": "ATATÜRK STADYUMU - KAMPÜS",
    "code": "15",
    "color": "#68bd9c",
    "vehicle_type": "bus",
    "fare_id": "SAK_0017_FARE_TAM",
    "route_pattern": "round_trip",
    "stop_mode": "fixed",
    "source": "api-sbb",
    "updated_at": "2026-07-31T09:24:24Z"
  },
  {
    "route_id": "SAK_0018",
    "agency_id": "sbb",
    "name": "K. TERMİNAL - SERDİVAN - KAMPÜS",
    "code": "16K",
    "color": "#68bd9c",
    "vehicle_type": "bus",
    "fare_id": "SAK_0018_FARE_TAM",
    "route_pattern": "round_trip",
    "stop_mode": "fixed",
    "source": "api-sbb",
    "updated_at": "2026-07-31T09:24:24Z"
  },
  {
    "route_id": "SAK_0019",
    "agency_id": "sbb",
    "name": "GÜNEŞLER - ADATIP - ŞİMŞEK EVLER",
    "code": "17",
    "color": "#68bd9c",
    "vehicle_type": "bus",
    "fare_id": "SAK_0019_FARE_TAM",
    "route_pattern": "round_trip",
    "stop_mode": "fixed",
    "source": "api-sbb",
    "updated_at": "2026-07-31T09:24:24Z"
  },
  {
    "route_id": "SAK_0020",
    "agency_id": "sbb",
    "name": "GÜNEŞLER - ÇARK - ŞİMŞEK EVLER",
    "code": "17S",
    "color": "#68bd9c",
    "vehicle_type": "bus",
    "fare_id": "SAK_0020_FARE_TAM",
    "route_pattern": "round_trip",
    "stop_mode": "fixed",
    "source": "api-sbb",
    "updated_at": "2026-07-31T09:24:24Z"
  },
  {
    "route_id": "SAK_0021",
    "agency_id": "sbb",
    "name": "ZİRAİ ALETLER - ADATIP - YILDIZ",
    "code": "18",
    "color": "#68bd9c",
    "vehicle_type": "bus",
    "fare_id": "SAK_0021_FARE_TAM",
    "route_pattern": "round_trip",
    "stop_mode": "fixed",
    "source": "api-sbb",
    "updated_at": "2026-07-31T09:24:24Z"
  },
  {
    "route_id": "SAK_0022",
    "agency_id": "sbb",
    "name": "DEMOKRASİ MEYDANI - KÖPRÜBAŞI",
    "code": "18S",
    "color": "#68bd9c",
    "vehicle_type": "bus",
    "fare_id": "SAK_0022_FARE_TAM",
    "route_pattern": "round_trip",
    "stop_mode": "fixed",
    "source": "api-sbb",
    "updated_at": "2026-07-31T09:24:24Z"
  },
  {
    "route_id": "SAK_0023",
    "agency_id": "sbb",
    "name": "D. MEYDANI - HACIOĞLU - SAKARYAPARK",
    "code": "19E",
    "color": "#68bd9c",
    "vehicle_type": "bus",
    "fare_id": "SAK_0023_FARE_TAM",
    "route_pattern": "round_trip",
    "stop_mode": "fixed",
    "source": "api-sbb",
    "updated_at": "2026-07-31T09:24:24Z"
  },
  {
    "route_id": "SAK_0024",
    "agency_id": "sbb",
    "name": "SAKARYAPARK - KAMPÜS",
    "code": "19K",
    "color": "#68bd9c",
    "vehicle_type": "bus",
    "fare_id": "SAK_0024_FARE_TAM",
    "route_pattern": "round_trip",
    "stop_mode": "fixed",
    "source": "api-sbb",
    "updated_at": "2026-07-31T09:24:24Z"
  },
  {
    "route_id": "SAK_0025",
    "agency_id": "sbb",
    "name": "ORTA GARAJ - ÇARK - SİVRİTEPE",
    "code": "19S",
    "color": "#68bd9c",
    "vehicle_type": "bus",
    "fare_id": "SAK_0025_FARE_TAM",
    "route_pattern": "loop",
    "stop_mode": "fixed",
    "source": "api-sbb",
    "updated_at": "2026-07-31T09:24:24Z"
  },
  {
    "route_id": "SAK_0026",
    "agency_id": "sbb",
    "name": "O.GARAJ - ALTINOVA - OTUZİKİEVLER - KAMPÜS",
    "code": "20",
    "color": "#68bd9c",
    "vehicle_type": "bus",
    "fare_id": "SAK_0026_FARE_TAM",
    "route_pattern": "loop",
    "stop_mode": "fixed",
    "source": "api-sbb",
    "updated_at": "2026-07-31T09:24:24Z"
  },
  {
    "route_id": "SAK_0027",
    "agency_id": "sbb",
    "name": "SERDİVAN AVM- BEŞKÖPRÜ-KAMPÜS",
    "code": "20A",
    "color": "#68bd9c",
    "vehicle_type": "bus",
    "fare_id": "SAK_0027_FARE_TAM",
    "route_pattern": "round_trip",
    "stop_mode": "fixed",
    "source": "api-sbb",
    "updated_at": "2026-07-31T09:24:24Z"
  },
  {
    "route_id": "SAK_0028",
    "agency_id": "sbb",
    "name": "DEMOKRASİ MEYDANI- S. ZAİM BLV - KARAMAN",
    "code": "21C",
    "color": "#68bd9c",
    "vehicle_type": "bus",
    "fare_id": "SAK_0028_FARE_TAM",
    "route_pattern": "loop",
    "stop_mode": "fixed",
    "source": "api-sbb",
    "updated_at": "2026-07-31T09:24:24Z"
  },
  {
    "route_id": "SAK_0029",
    "agency_id": "sbb",
    "name": "UNKAPANI - İKİZCE - KARAMAN",
    "code": "21D",
    "color": "#68bd9c",
    "vehicle_type": "bus",
    "fare_id": "SAK_0029_FARE_TAM",
    "route_pattern": "loop",
    "stop_mode": "fixed",
    "source": "api-sbb",
    "updated_at": "2026-07-31T09:24:24Z"
  },
  {
    "route_id": "SAK_0030",
    "agency_id": "sbb",
    "name": "KARAMAN - KAMPÜS",
    "code": "21K",
    "color": "#68bd9c",
    "vehicle_type": "bus",
    "fare_id": "SAK_0030_FARE_TAM",
    "route_pattern": "round_trip",